Title,Description,Price,Image URL
Laptop,High-performance laptop with sleek design.,$800,https://source.unsplash.com/150x150/?Laptop
Smartphone,Latest smartphone with amazing features.,$600,https://source.unsplash.com/150x150/?Smartphone
Headphones,Premium quality headphones for immersive sound experience.,$200,https://source.unsplash.com/150x150/?Headphones
Tablet,Portable tablet with long battery life.,$400,https://source.unsplash.com/150x150/?Tablet
Smartwatch,Smartwatch with fitness tracking and heart rate monitoring.,$300,https://source.unsplash.com/150x150/?Smartwatch
Camera,Professional camera with high-quality image capture.,$1000,https://source.unsplash.com/150x150/?Camera
Printer,Wireless printer for easy printing and scanning.,$150,https://source.unsplash.com/150x150/?Printer
Monitor,High-resolution monitor for clear display.,$300,https://source.unsplash.com/150x150/?Monitor
